{
  "spec_version": "0.1",
  "product_id": "dalba-toneup-purple",
  "stage": "copy",
  "sources": [
    {
      "id": "S1",
      "section": "제품 설명",
      "quote": "워터풀 톤업 선크림 (퍼플) [미백·주름개선·자외선차단 3중 기능성 화장품] SPF50+/PA++++"
    },
    {
      "id": "S2",
      "section": "제품 설명",
      "quote": "매일 부담 없이 사용할 수 있는 데일리 UV 케어를 완성합니다."
    },
    {
      "id": "S3",
      "section": "주요 특징",
      "quote": "미백, 주름개선, 자외선차단(SPF50+/PA++++) 3중 기능성 화장품 / 화장품법에 따른 기능성 화장품 심사(또는 보고)를 필함"
    },
    {
      "id": "S4",
      "section": "주요 특징",
      "quote": "세미 매트 제형으로 깔끔하고 부드럽게 피부에 밀착되어 번들거림 없이 가볍고 산뜻 보송한 마무리감을 선사합니다."
    },
    {
      "id": "S5",
      "section": "주요 특징",
      "quote": "서로 보색 관계인 컬러가 섞이면서 보라빛으로 노란 톤은 잡고 화사하게 쿨톤 보정"
    },
    {
      "id": "S6",
      "section": "주요 특징",
      "quote": "하얗게 들뜨는 백탁 현상 없이 노란기를 잡아주는 쿨톤 보정 효과"
    },
    {
      "id": "S7",
      "section": "주요 특징",
      "quote": "인체피부 일차자극(저자극) 인체적용시험 완료 (시험 기관 : 피엔케이피부임상연구센타 / 2024.03.20~2024.03.22 / 34명 / 개인차 有)"
    },
    {
      "id": "S8",
      "section": "주요 특징",
      "quote": "V-LABEL 비건 인증 완료"
    },
    {
      "id": "S9",
      "section": "사용 방법",
      "quote": "스킨케어 마지막 단계에서 적당량을 취해 피부에 골고루 펴 발라줍니다."
    },
    {
      "id": "S10",
      "section": "사용 방법",
      "quote": "쌀 한 톨 만큼의 양을 이마2, 양 볼3, 턱2, 코1 부위로 나눈 후 얇게 펴 발라 주세요!"
    },
    {
      "id": "S11",
      "section": "주의사항",
      "quote": "상처가 있는 부위 등에는 사용을 자제할 것"
    }
  ],
  "analysis": {
    "core_message": "노란 톤을 잡는 퍼플 쿨톤 보정에 3중 기능성을 더한 데일리 톤업 선크림",
    "core_evidence": [
      "S1",
      "S5"
    ],
    "features": [
      {
        "summary": "미백·주름개선·자외선차단(SPF50+/PA++++) 3중 기능성, 기능성 심사(보고) 완료",
        "evidence": [
          "S3",
          "S1"
        ]
      },
      {
        "summary": "보라빛 보색으로 노란 톤을 잡는 쿨톤 보정",
        "evidence": [
          "S5"
        ]
      },
      {
        "summary": "백탁 없이 노란기를 잡는 쿨톤 보정",
        "evidence": [
          "S6"
        ]
      },
      {
        "summary": "세미 매트 제형, 번들거림 없이 산뜻 보송한 마무리",
        "evidence": [
          "S4"
        ]
      },
      {
        "summary": "저자극 인체적용시험 완료, V-LABEL 비건 인증",
        "evidence": [
          "S7",
          "S8"
        ]
      }
    ],
    "usage": [
      {
        "summary": "스킨케어 마지막 단계에 적당량을 골고루",
        "evidence": [
          "S9"
        ]
      },
      {
        "summary": "쌀 한 톨 양을 이마·볼·턱·코에 나눠 얇게",
        "evidence": [
          "S10"
        ]
      },
      {
        "summary": "상처가 있는 부위는 사용 자제",
        "evidence": [
          "S11"
        ]
      }
    ]
  },
  "cards": [
    {
      "no": 1,
      "role": "cover",
      "template": "cover",
      "intent": "제품명과 핵심 메시지(노란 톤을 잡는 쿨톤 보정 + 3중 기능성) 전달",
      "image": "main.png",
      "evidence": [
        "S1",
        "S5"
      ],
      "copy": {
        "badge": "SPF50+",
        "title": "노란 톤은 잡고\n화사한 쿨톤으로",
        "subtitle": "3중 기능성 워터풀 톤업 선크림(퍼플)"
      }
    },
    {
      "no": 2,
      "role": "feature",
      "template": "image",
      "intent": "강조 정보: 3중 기능성(미백·주름개선·자외선차단 SPF50+/PA++++)을 제품 이미지와 함께",
      "image": "main.png",
      "evidence": [
        "S3",
        "S1"
      ],
      "copy": {
        "title": "3중 기능성\n톤업 선크림",
        "caption": "미백·주름개선·자외선차단 SPF50+/PA++++ 기능성이에요"
      }
    },
    {
      "no": 3,
      "role": "feature",
      "template": "description",
      "intent": "쿨톤 보정과 사용감 3가지: 보색 쿨톤 보정, 백탁 없음, 세미 매트 산뜻 보송",
      "image": null,
      "evidence": [
        "S5",
        "S6",
        "S4"
      ],
      "copy": {
        "title": "노란 톤은 잡고, 산뜻하게",
        "items": [
          "보라빛 보색으로 노란 톤을 잡는 쿨톤 보정",
          "하얗게 들뜨는 백탁 없이 노란기를 잡아요",
          "세미 매트 제형으로 번들거림 없이 보송하게"
        ]
      }
    },
    {
      "no": 4,
      "role": "usage",
      "template": "description",
      "intent": "사용 방법 2단계 + 주의사항 1줄",
      "image": null,
      "evidence": [
        "S9",
        "S10",
        "S11"
      ],
      "copy": {
        "title": "이렇게 발라 주세요",
        "items": [
          "스킨케어 마지막 단계에 골고루 펴 발라요",
          "쌀 한 톨 양을 이마·볼·턱·코에 나눠 얇게",
          "상처가 있는 부위에는 사용을 자제해요"
        ]
      }
    },
    {
      "no": 5,
      "role": "closing",
      "template": "cover",
      "intent": "핵심 메시지 다시 정리 + 저자극 인체적용시험·비건 인증으로 마무리",
      "image": "main.png",
      "evidence": [
        "S2",
        "S7",
        "S8"
      ],
      "copy": {
        "title": "매일 부담 없이\n데일리 UV 케어",
        "subtitle": "저자극 인체적용시험 완료 · V-LABEL 비건 인증"
      }
    }
  ]
}
